,number,value,datetime_start,datetime_complete,duration,params_activation_fn,params_batch_size,params_buffer_size,params_exploration_fraction,params_gamma,params_gradient_steps,params_learning_rate,params_learning_starts,params_max_grad_norm,params_net_arch,params_target_update_interval,params_tau,params_train_freq,user_attrs_gamma,state
86,86,-390.3169008,2025-01-18 07:07:20.891879,2025-01-18 07:07:27.173308,0 days 00:00:06.281429,tanh,9,5,0.11434119238753061,0.994369954870819,3,1.0745516997482463e-05,9,4.353457026913079,tiny,7,0.771053882361441,94,0.994369954870819,PRUNED
87,87,-539.3266535,2025-01-18 07:07:27.174488,2025-01-18 07:07:32.727796,0 days 00:00:05.553308,tanh,8,6,0.13474171479708708,0.9214787522845849,4,0.00010914031907704053,5,4.979332375191817,tiny,3,0.9104773863908057,100,0.9214787522845849,PRUNED
88,88,-426.8552386,2025-01-18 07:07:32.728697,2025-01-18 07:07:38.587846,0 days 00:00:05.859149,relu,9,7,0.08552985052559234,0.9975994840791986,2,3.0283368417274977e-05,7,2.859064640317363,small,6,0.7934723917031072,198,0.9975994840791986,PRUNED
89,89,-290.406401,2025-01-18 07:07:38.589117,2025-01-18 07:07:49.536463,0 days 00:00:10.947346,tanh,10,6,0.15122990467093717,0.9834020349178055,4,0.001042778159410468,8,4.480972079275691,tiny,7,0.7582694152669508,108,0.9834020349178055,COMPLETE
90,90,-596.2056955999999,2025-01-18 07:07:49.537455,2025-01-18 07:07:55.792686,0 days 00:00:06.255231,tanh,8,6,0.48389103096117453,0.9993246424456758,3,0.0030472773595919423,9,3.8421465345032226,tiny,7,0.7779959433772166,118,0.9993246424456758,PRUNED
91,91,-350.64946640000005,2025-01-18 07:07:55.794051,2025-01-18 07:08:01.616832,0 days 00:00:05.822781,tanh,6,3,0.23415853949852716,0.987389444045755,3,0.011676842301784606,9,4.0132150077073,tiny,7,0.8847769752407751,173,0.987389444045755,PRUNED
92,92,-458.9098166,2025-01-18 07:08:01.617728,2025-01-18 07:08:07.980443,0 days 00:00:06.362715,tanh,7,3,0.3382210218555327,0.9598041007312292,3,0.005919708699993873,9,4.1959169165428065,tiny,7,0.890270347779461,184,0.9598041007312292,PRUNED
93,93,-183.25417190000002,2025-01-18 07:08:07.981398,2025-01-18 07:08:13.547360,0 days 00:00:05.565962,tanh,5,7,0.3169916511648676,0.9544566538129763,3,0.017773281276896327,6,4.585529536558072,tiny,7,0.8988281260850998,76,0.9544566538129763,PRUNED
94,94,-433.2100041,2025-01-18 07:08:13.548089,2025-01-18 07:08:19.256527,0 days 00:00:05.708438,tanh,7,3,0.2934888402440421,0.9479265192279103,3,0.007604010606434925,9,4.884949287987516,tiny,7,0.8807644742776657,90,0.9479265192279103,PRUNED
95,95,-513.4002654,2025-01-18 07:08:19.257384,2025-01-18 07:08:25.484981,0 days 00:00:06.227597,tanh,10,5,0.27179668390316203,0.9444339484174264,3,0.004746010141111802,9,4.381281389517995,tiny,3,0.8753414751084829,189,0.9444339484174264,PRUNED
96,96,-647.5628165,2025-01-18 07:08:25.486081,2025-01-18 07:08:31.753598,0 days 00:00:06.267517,tanh,6,6,0.06014169530145165,0.9901049994376127,2,2.2840630607856205e-05,10,4.146930151110146,tiny,5,0.9169346387753066,37,0.9901049994376127,PRUNED
97,97,-544.611859,2025-01-18 07:08:31.754436,2025-01-18 07:08:37.372462,0 days 00:00:05.618026,tanh,9,3,0.0690704690002939,0.9801510687045907,3,0.040286579286789914,8,3.602166919719724,tiny,7,0.8556951856384425,162,0.9801510687045907,PRUNED
98,98,-782.1312641000001,2025-01-18 07:08:37.373100,2025-01-18 07:08:44.103804,0 days 00:00:06.730704,tanh,4,4,0.17251762821979086,0.9527021148416895,1,0.03513672749211891,8,4.772055749694054,tiny,3,0.8871563927521215,137,0.9527021148416895,PRUNED
99,99,-535.0258653,2025-01-18 07:08:44.105338,2025-01-18 07:08:50.190404,0 days 00:00:06.085066,relu,5,6,0.10329330175504178,0.9567691672295296,3,5.476418098500326e-05,9,3.1462854372399374,small,6,0.9110282464053533,195,0.9567691672295296,PRUNED
