,number,value,datetime_start,datetime_complete,duration,params_activation_fn,params_batch_size,params_clip_range,params_ent_coef,params_gae_lambda,params_gamma,params_learning_rate,params_max_grad_norm,params_n_epochs,params_n_steps,params_net_arch,params_target_kl,params_vf_coef,state
77,77,-inf,2025-02-02 22:16:52.103461,2025-02-02 22:16:52.133539,0 days 00:00:00.030078,relu,163,0.2500034085025721,0.00036999736976755994,0.8371697164794034,0.9971150369228856,8.51343547746688e-05,4.317750598980283,3,239,tiny,0.19317861357085808,0.8093244703698498,COMPLETE
78,78,-inf,2025-02-02 22:16:52.134461,2025-02-02 22:16:52.165073,0 days 00:00:00.030612,tanh,215,0.2861141526534518,0.0006640614149499596,0.9530828211027452,0.993818838881927,0.0001943953230964152,3.0256664794908987,10,87,small,0.12831811951179173,0.859427808417479,COMPLETE
79,79,-inf,2025-02-02 22:16:52.166132,2025-02-02 22:16:52.196765,0 days 00:00:00.030633,tanh,65,0.19642417146329466,0.0001541511022927522,0.8547103136261752,0.9476672648578661,0.00013829154508062687,4.518686610990124,4,67,small,0.16387658344392073,0.6114904415347863,COMPLETE
80,80,-inf,2025-02-02 22:16:52.197645,2025-02-02 22:16:52.225153,0 days 00:00:00.027508,relu,152,0.18185369557985587,0.006829328122698969,0.9318005805655398,0.9839742943683218,0.00011731939617580076,4.047611340797549,9,137,tiny,0.15162686229388786,0.5880129991872409,COMPLETE
81,81,-inf,2025-02-02 22:16:52.225889,2025-02-02 22:16:52.254477,0 days 00:00:00.028588,relu,177,0.2070180048904487,6.0064089724086016e-05,0.8758221801343349,0.9101359979586151,2.3850078196476387e-05,1.658747418196523,10,17,tiny,0.10682747282486464,0.9917536766871698,COMPLETE
82,82,-inf,2025-02-02 22:16:52.255188,2025-02-02 22:16:52.284695,0 days 00:00:00.029507,relu,237,0.1725761485720619,9.754498957033877e-05,0.9724255152913943,0.900330737235199,3.0708111550052186e-05,2.3452754629436834,9,93,tiny,0.09781741106684168,0.9037173666831488,COMPLETE
83,83,-inf,2025-02-02 22:16:52.285454,2025-02-02 22:16:52.314312,0 days 00:00:00.028858,relu,191,0.18888960691635737,6.494949792838638e-05,0.8235816781531387,0.9335172352742558,3.609885300530061e-05,2.029436022565653,10,29,tiny,0.11460855609050559,0.9194089307568584,COMPLETE
84,84,-inf,2025-02-02 22:16:52.315030,2025-02-02 22:16:52.343223,0 days 00:00:00.028193,relu,223,0.2212271451255292,2.0237568692079877e-05,0.8960193956165342,0.9036615715004048,1.6042108119859508e-05,2.2571215996580882,9,209,tiny,0.06473949305069823,0.953682297755551,COMPLETE
85,85,-inf,2025-02-02 22:16:52.343973,2025-02-02 22:16:52.373663,0 days 00:00:00.029690,relu,210,0.20201814316762703,0.0002459144567635346,0.902939921397088,0.9236512230085194,2.5370357417228646e-05,4.964543290643419,2,36,tiny,0.031227241390230635,0.9381799488898859,COMPLETE
86,86,-inf,2025-02-02 22:16:52.374378,2025-02-02 22:16:52.404704,0 days 00:00:00.030326,tanh,45,0.23232726727140435,4.053641880410629e-05,0.8677103447704105,0.9199995441695261,2.105558425212598e-05,2.75583237767584,7,256,small,0.1831702370249063,0.7851297187883843,COMPLETE
87,87,-inf,2025-02-02 22:16:52.405421,2025-02-02 22:16:52.434220,0 days 00:00:00.028799,tanh,83,0.15125219706461887,0.0010851130060742363,0.8862016583290969,0.9128681802231469,6.329283498479528e-05,2.4877354816129302,5,219,small,0.046141015224897164,0.8306452404254354,COMPLETE
88,88,-inf,2025-02-02 22:16:52.434965,2025-02-02 22:16:52.465062,0 days 00:00:00.030097,relu,171,0.2790036292951845,1.6280212354549025e-05,0.8373919489244699,0.9270495143243399,0.00015620996313248065,0.5000054183454763,10,61,tiny,0.07447311816865383,0.9721442471598253,COMPLETE
89,89,-inf,2025-02-02 22:16:52.465788,2025-02-02 22:16:52.496035,0 days 00:00:00.030247,tanh,249,0.10894655708574254,0.0001107309515717841,0.9224961251495317,0.964731255939816,1.3015723749663389e-05,1.8586495768346976,8,53,small,0.14552630775487707,0.7557664919830923,COMPLETE
90,90,-inf,2025-02-02 22:16:52.496762,2025-02-02 22:16:52.526594,0 days 00:00:00.029832,tanh,27,0.25413432241403966,0.004307757120834162,0.8003969277869987,0.9998362738809309,9.759985105013476e-05,1.432754437221279,6,192,small,0.12465143184076113,0.5517755179372994,COMPLETE
91,91,-inf,2025-02-02 22:16:52.527377,2025-02-02 22:16:52.556137,0 days 00:00:00.028760,tanh,205,0.2443548173888202,0.0020202931980698832,0.9459271134702962,0.9297407301721374,4.1947373427961096e-05,3.734087703852385,4,112,small,0.19611531720621564,0.5361761596243992,COMPLETE
92,92,-inf,2025-02-02 22:16:52.556870,2025-02-02 22:16:52.586075,0 days 00:00:00.029205,tanh,227,0.2619947260799748,0.008220828278540423,0.8507221687638772,0.9358609180769744,4.731075817401237e-05,3.3721667251982668,3,108,small,0.19730539676935946,0.9348506311783105,COMPLETE
93,93,-inf,2025-02-02 22:16:52.586790,2025-02-02 22:16:52.617119,0 days 00:00:00.030329,tanh,193,0.2948213775919818,3.217196359617834e-05,0.9404976032538699,0.9383045540162712,3.217776930684774e-05,3.138192428265514,5,100,small,0.18678762610932223,0.5236087053927445,COMPLETE
94,94,-inf,2025-02-02 22:16:52.617848,2025-02-02 22:16:52.647639,0 days 00:00:00.029791,tanh,207,0.2715202975631981,0.0016292740179691119,0.9306041377189058,0.953243204116502,0.000993332665400313,3.5486144419165373,4,125,small,0.08240340574098776,0.5007448891574406,COMPLETE
95,95,-inf,2025-02-02 22:16:52.648362,2025-02-02 22:16:52.679750,0 days 00:00:00.031388,relu,217,0.240049564206367,0.001286691525002822,0.8078268240634459,0.9316467430651989,8.060717043777596e-05,3.2567446373996685,1,179,small,0.15986546689071635,0.85372181164858,COMPLETE
96,96,-inf,2025-02-02 22:16:52.680463,2025-02-02 22:16:52.710195,0 days 00:00:00.029732,tanh,184,0.28631276404395045,0.00473249181676986,0.9100374998404409,0.9150762357028308,5.684235519392762e-05,3.8059866838114536,5,75,tiny,0.020885344080182264,0.6482983417247009,COMPLETE
97,97,-inf,2025-02-02 22:16:52.711022,2025-02-02 22:16:52.742624,0 days 00:00:00.031602,tanh,163,0.2556139369178072,0.00032703625800353613,0.8284741509081809,0.9376513089893089,2.7065513570209298e-05,3.94901047225866,8,249,small,0.17587176249050318,0.6686215198014175,COMPLETE
98,98,-inf,2025-02-02 22:16:52.743338,2025-02-02 22:16:52.775541,0 days 00:00:00.032203,relu,239,0.2662570709554615,0.0022221448615121855,0.9161230329169734,0.945921287518656,3.875992944565762e-05,3.008554615362305,6,233,small,0.12009212883841872,0.5353610888302067,COMPLETE
99,99,-inf,2025-02-02 22:16:52.776258,2025-02-02 22:16:52.806881,0 days 00:00:00.030623,tanh,14,0.230728725187409,1.0383645521173948e-05,0.9050130032813991,0.9562110807341262,6.87754819815779e-05,0.6539794815166058,3,134,tiny,0.19181226698391082,0.8406506814340166,COMPLETE
