,number,value,datetime_start,datetime_complete,duration,params_activation_fn,params_batch_size,params_clip_range,params_ent_coef,params_gae_lambda,params_gamma,params_learning_rate,params_max_grad_norm,params_n_epochs,params_n_steps,params_net_arch,params_target_kl,params_vf_coef,user_attrs_gamma,state
0,0,-inf,2025-01-28 22:23:24.029404,2025-01-28 22:23:57.684233,0 days 00:00:33.654829,relu,6,0.2405527117611638,0.02189762679402271,0.8655387073048394,0.9107238741574982,1.5982843041843627e-05,1.554596593101503,6,12,small,0.1821336744932124,0.7099663631144432,0.9107238741574982,COMPLETE
1,1,-inf,2025-01-28 22:23:57.684945,2025-01-28 22:24:12.021576,0 days 00:00:14.336631,relu,7,0.19617610099375893,0.030665442269363862,0.8803476955345844,0.9147320157831164,0.03092872830963851,0.5358331936750367,8,10,small,0.14127675178046406,0.44667162998308374,0.9147320157831164,COMPLETE
2,2,-inf,2025-01-28 22:24:12.022422,2025-01-28 22:24:23.734907,0 days 00:00:11.712485,tanh,7,0.2899046586071111,0.019693172330313827,0.9467036302486889,0.9032804943008576,0.7975309759330347,4.87596191329839,5,10,small,0.09136665790855543,0.7630962040930603,0.9032804943008576,COMPLETE
3,3,-inf,2025-01-28 22:24:23.736195,2025-01-28 22:24:35.598222,0 days 00:00:11.862027,relu,7,0.23745629373876048,0.0010649137937541323,0.8915940776376616,0.9559894612955998,0.00020794866799093092,4.714404889555553,3,9,tiny,0.12410437587193673,0.6579981026093832,0.9559894612955998,COMPLETE
4,4,-inf,2025-01-28 22:24:35.599117,2025-01-28 22:24:51.245065,0 days 00:00:15.645948,tanh,9,0.20301189485619237,0.011927237833534634,0.8508563111564579,0.9809862808116705,0.0023297626902393774,3.3200769507748937,8,8,small,0.1023232058648112,0.4914691875480699,0.9809862808116705,COMPLETE
5,5,-inf,2025-01-28 22:24:51.245923,2025-01-28 22:25:28.442445,0 days 00:00:37.196522,relu,5,0.10782572013383833,0.00012260613301712407,0.8268665354790885,0.9367308990623988,1.0561435922621972e-05,0.9286382833549754,10,12,tiny,0.1916031533527281,0.9622853971152655,0.9367308990623988,COMPLETE
6,6,-inf,2025-01-28 22:25:28.443408,2025-01-28 22:26:17.765700,0 days 00:00:49.322292,relu,5,0.2994576013425273,0.09806256692246783,0.9915039953720793,0.9407024603538277,1.4860633441238727e-05,2.011141117890231,5,12,small,0.011270195622464091,0.11973878887949557,0.9407024603538277,COMPLETE
7,7,-inf,2025-01-28 22:26:17.766545,2025-01-28 22:26:26.850556,0 days 00:00:09.084011,relu,10,0.13120926031261398,0.002364925236591501,0.934000725398765,0.9983575222849137,0.0002547539180369284,2.1767108172488663,6,7,small,0.1960624407037773,0.9770190246675703,0.9983575222849137,COMPLETE
8,8,-inf,2025-01-28 22:26:26.851439,2025-01-28 22:26:39.729889,0 days 00:00:12.878450,tanh,6,0.23284602467671336,0.00043696037449290594,0.8040892375317884,0.9237676001587299,0.006703127745458914,3.2833028360082244,3,11,tiny,0.04791892616755358,0.26023122426651113,0.9237676001587299,COMPLETE
9,9,-inf,2025-01-28 22:26:39.730589,2025-01-28 22:26:50.797889,0 days 00:00:11.067300,relu,9,0.159177253733036,0.005764974844051823,0.8656171272883338,0.9636837400232788,0.0001367032487664507,1.4816571334874062,8,11,small,0.16502835743111693,0.7536240110770918,0.9636837400232788,COMPLETE
10,10,-inf,2025-01-28 22:26:50.798760,2025-01-28 22:26:58.245472,0 days 00:00:07.446712,tanh,6,0.24161963727754332,0.053056511358456376,0.9218157984333905,0.9022606376484393,0.2340047624345783,3.311461216751466,10,9,tiny,0.06947790654268692,0.3295018823275413,0.9022606376484393,COMPLETE
11,11,-inf,2025-01-28 22:26:58.246405,2025-01-28 22:27:11.030472,0 days 00:00:12.784067,relu,8,0.18317528582647352,0.026859288646219785,0.8818285162176263,0.9190655741963608,0.03054220282589258,0.3175377514081626,8,10,small,0.1427130081781469,0.4886607211697953,0.9190655741963608,COMPLETE
12,12,-inf,2025-01-28 22:27:11.031465,2025-01-28 22:27:20.784681,0 days 00:00:09.753216,relu,6,0.20312574629706168,0.010628476063163715,0.8443421644709659,0.9228295627737116,0.03181994405488457,0.4790243381890379,7,11,small,0.15783456462012047,0.6351554807666688,0.9228295627737116,COMPLETE
13,13,-inf,2025-01-28 22:27:20.785680,2025-01-28 22:28:26.956467,0 days 00:01:06.170787,relu,8,0.26359788195747047,0.03936530820519544,0.905877250798997,0.9126279925827064,0.0020928820966171716,1.074160252909945,6,12,small,0.17065126009932555,0.39542068266232544,0.9126279925827064,COMPLETE
14,14,-inf,2025-01-28 22:28:26.957326,2025-01-28 22:28:35.849151,0 days 00:00:08.891825,relu,7,0.1726644069256619,0.007018589283438836,0.9600033330755745,0.9332966345808937,0.0503733645797028,1.5987553914976624,9,8,small,0.13433762533389507,0.81603898118974,0.9332966345808937,COMPLETE
15,15,-inf,2025-01-28 22:28:35.850103,2025-01-28 22:28:49.874263,0 days 00:00:14.024160,relu,6,0.26660143546032533,0.08665788200540918,0.8719747651943934,0.9093866302240107,0.007433524263906323,2.6342005615442856,5,10,small,0.12128916875090284,0.5924936065197004,0.9093866302240107,COMPLETE
16,16,-inf,2025-01-28 22:28:49.875010,2025-01-28 22:29:03.703981,0 days 00:00:13.828971,relu,5,0.21671243020293326,0.0028103521645436503,0.9064007200230252,0.9488285389302562,0.0005515425817187722,0.9631026843681079,7,11,small,0.16009352548647532,0.415785705684269,0.9488285389302562,COMPLETE
17,17,-inf,2025-01-28 22:29:03.704878,2025-01-28 22:29:12.769709,0 days 00:00:09.064831,relu,8,0.15392020731444667,0.02187477497894267,0.8254504037644114,0.9274014274084127,0.08459580193386712,1.5734499152599477,4,9,small,0.18476504868067928,0.8521731608976866,0.9274014274084127,COMPLETE
18,18,-inf,2025-01-28 22:29:12.770741,2025-01-28 22:29:22.861224,0 days 00:00:10.090483,tanh,7,0.26372886978067545,0.0011733094688339293,0.8549745091981609,0.9150955958629363,5.5338463090962595e-05,2.3095745882769645,9,7,tiny,0.14265997220944474,0.19982286698045404,0.9150955958629363,COMPLETE
19,19,,2025-01-28 22:29:22.862098,2025-01-28 22:30:03.293776,0 days 00:00:40.431678,relu,6,0.21919981922330883,0.04644086444532992,0.8344294028655276,0.9711060929398074,0.0007703603133968627,0.639815129465893,7,12,small,0.17287832741566356,0.6808189017981737,0.9711060929398074,FAIL
